{
  "$schema": "../../schema/family.schema.json",
  "id": "multiboard",
  "name": "Multiboard",
  "category": "wall",
  "tags": [],
  "summary": "Reference site names multiboard/multiboard.scad with no source link; need the specific generator.",
  "authors": [],
  "source": null,
  "license": {
    "spdx": "NOASSERTION",
    "public_use": "blocked"
  },
  "links": {},
  "engine": null,
  "status": "missing-source",
  "models": []
}
