{
  "$schema": "../../schema/family.schema.json",
  "id": "opengrid",
  "name": "openGrid",
  "category": "wall",
  "tags": [
    "wall",
    "tiles",
    "snaps",
    "borders"
  ],
  "summary": "openGrid wall tiles, snaps and borders.",
  "authors": [
    {
      "name": "David D (openGrid design)",
      "url": "https://www.opengrid.world/"
    },
    {
      "name": "Andy Levesque / QuackWorks",
      "url": "https://github.com/AndyLevesque"
    }
  ],
  "source": {
    "repository": "https://github.com/AndyLevesque/QuackWorks",
    "commit": "e0c1cb7ec78dd9e9a8476ed739bd3402074354f3",
    "vendor_path": "vendor/quackworks"
  },
  "license": {
    "spdx": "CC-BY-NC-SA-4.0",
    "public_use": "review",
    "notes": "Code is non-commercial; file headers license derived parts CC-BY-4.0. Confirm terms before a public or monetized service."
  },
  "links": {
    "openGrid": "https://www.opengrid.world/"
  },
  "engine": {
    "min_version": "2021.01",
    "backend": "manifold",
    "library_paths": [
      "vendor/libraries"
    ]
  },
  "status": "partial",
  "models": [
    {
      "id": "tile",
      "name": "Grid",
      "entrypoint": "vendor/quackworks/openGrid/openGrid.scad",
      "status": "available"
    },
    {
      "id": "snap",
      "name": "Snap",
      "entrypoint": "adapters/opengrid/opengrid-snap.scad",
      "notes": "Thin adapter: upstream file is a module library with a hard-coded call.",
      "status": "available"
    },
    {
      "id": "border",
      "name": "Border",
      "entrypoint": "vendor/quackworks/openGrid/openGrid-border.scad",
      "status": "available"
    },
    {
      "id": "connector",
      "name": "Connector",
      "entrypoint": null,
      "status": "missing-source",
      "notes": "Reference site's opengrid-connectors.scad is not in the linked upstream."
    }
  ]
}
