{
  "$schema": "../../schema/family.schema.json",
  "id": "gridfinity-rugged-box",
  "name": "Gridfinity Rugged Box",
  "category": "carrying",
  "tags": [
    "boxes",
    "latches",
    "handles",
    "hinges"
  ],
  "summary": "Latching, stackable rugged box with Gridfinity floor and lid.",
  "authors": [
    {
      "name": "smkent",
      "url": "https://github.com/smkent"
    }
  ],
  "source": {
    "repository": "https://github.com/smkent/monoscad",
    "commit": "069891b93f8b70765560ba07a67aa1970a88cb82",
    "vendor_path": "vendor/monoscad"
  },
  "license": {
    "spdx": "CC-BY-SA-4.0 AND MIT",
    "public_use": "ok",
    "notes": "Share-alike applies to generated derivatives."
  },
  "links": {},
  "engine": {
    "min_version": "2021.01",
    "backend": "manifold",
    "library_paths": [
      "vendor/monoscad/libraries"
    ],
    "notes": "Uses an older Rebuilt library pin (0b7bf6e); do not share with the current Rebuilt."
  },
  "status": "available",
  "models": [
    {
      "id": "box",
      "name": "Rugged Box",
      "entrypoint": "vendor/monoscad/gridfinity/rugged-box/rugged-box-gridfinity.scad",
      "part_parameter": "Part",
      "defaults": {
        "Part": "bottom"
      },
      "status": "available"
    }
  ]
}
