{
  "$schema": "../../schema/family.schema.json",
  "id": "label-generator-gridfinity",
  "name": "Label Generator for Gridfinity",
  "category": "labels",
  "tags": [
    "labels",
    "bins",
    "storage boxes",
    "bolts",
    "nuts",
    "washers",
    "inserts"
  ],
  "summary": "Labels for Pred's Gridfinity bins and storage boxes, with hardware icons (bolts, screws, nuts, washers, inserts) or custom text.",
  "authors": [
    {
      "name": "Laurens Guijt",
      "url": "https://github.com/laurensguijt"
    }
  ],
  "source": {
    "repository": "https://github.com/laurensguijt/Label-Generator-Gridfinity",
    "commit": "350b406dde4471e8be0a34b0147422db8a60226f",
    "vendor_path": "vendor/label-generator-gridfinity",
    "commit_date": "2026-02-18T16:56:13+01:00"
  },
  "license": {
    "spdx": "GPL-3.0-only",
    "public_use": "ok",
    "notes": "Offer the SCAD source with generated files."
  },
  "links": {
    "Bin labels on MakerWorld": "https://makerworld.com/en/models/769441",
    "Box labels on MakerWorld": "https://makerworld.com/en/models/738730"
  },
  "engine": {
    "min_version": "2026.01",
    "backend": "manifold",
    "library_paths": [
      "vendor/libraries"
    ]
  },
  "status": "available",
  "models": [
    {
      "id": "bin-label",
      "name": "Bin Label",
      "entrypoint": "vendor/label-generator-gridfinity/gridfinity_bin_label.scad",
      "status": "available",
      "notes": "For Pred's Gridfinity bins with printable label. Fonts the model lists fall back to Liberation Sans in the browser.",
      "ui": {
        "text_font": {
          "options": [
            {
              "value": "Liberation Sans",
              "label": "Liberation Sans"
            },
            {
              "value": "Liberation Mono",
              "label": "Liberation Mono"
            }
          ],
          "label": "Font"
        },
        "Font_Style": {
          "options": [
            "Regular",
            "Bold"
          ],
          "label": "Font style"
        },
        "diameter": {
          "label": "Size text",
          "display-condition": {
            "js": "Component != 'Custom Text'"
          }
        },
        "hardware_length": {
          "label": "Length (mm)",
          "display-condition": {
            "js": "Component != 'Custom Text'"
          }
        },
        "Y_units": {
          "label": "Label size (units)"
        },
        "text_type": {
          "label": "Text style"
        },
        "text_size": {
          "label": "Text size (mm)"
        },
        "custom_text": {
          "label": "Custom text",
          "display-condition": {
            "js": "Component == 'Custom Text'"
          }
        },
        "batch_export": {
          "label": "Batch export (many labels)"
        },
        "Hardware_type": {
          "label": "Hardware"
        },
        "LOGO_TYPE": {
          "label": "Logo type"
        },
        "LOGO_EMOJI": {
          "label": "Emoji"
        },
        "LOGO_CHAR": {
          "label": "Logo text"
        },
        "LOGO_SIZE": {
          "label": "Logo size"
        },
        "LOGO_ROTATION": {
          "label": "Logo rotation"
        },
        "Line_1_text": {
          "label": "Line 1"
        },
        "Line_2_text": {
          "label": "Line 2"
        },
        "Line_3_text": {
          "label": "Line 3"
        },
        "Line_4_text": {
          "label": "Line 4"
        },
        "Filter_Empty_Lines": {
          "label": "Skip empty lines"
        },
        "line_spacing_factor": {
          "label": "Line spacing"
        },
        "text_height": {
          "label": "Raised text height (mm)"
        },
        "margin_factor": {
          "label": "Margin"
        },
        "width": {
          "label": "Width (mm)"
        },
        "height": {
          "label": "Thickness (mm)"
        },
        "radius": {
          "label": "Corner radius (mm)"
        },
        "champfer": {
          "label": "Chamfer (mm)"
        },
        "Show_Divider": {
          "label": "Divider line"
        }
      },
      "hidden": [
        "Content_color",
        "Label_color"
      ]
    },
    {
      "id": "box-label",
      "name": "Storage Box Label",
      "entrypoint": "vendor/label-generator-gridfinity/gridfinity_box_label.scad",
      "status": "available",
      "notes": "For Pred's Gridfinity storage boxes. Emoji logos need an emoji font the browser engine doesn't have; use the character or hardware logo.",
      "ui": {
        "text_font": {
          "options": [
            {
              "value": "Liberation Sans",
              "label": "Liberation Sans"
            },
            {
              "value": "Liberation Mono",
              "label": "Liberation Mono"
            }
          ],
          "label": "Font"
        },
        "Font_Style": {
          "options": [
            "Regular",
            "Bold"
          ],
          "label": "Font style"
        },
        "diameter": {
          "label": "Size text"
        },
        "hardware_length": {
          "label": "Length (mm)"
        },
        "Y_units": {
          "label": "Label size (units)"
        },
        "text_type": {
          "label": "Text style"
        },
        "text_size": {
          "label": "Text size (mm)"
        },
        "custom_text": {
          "label": "Custom text"
        },
        "batch_export": {
          "label": "Batch export (many labels)"
        },
        "Hardware_type": {
          "label": "Hardware",
          "display-condition": {
            "js": "LOGO_TYPE == 'hardware'"
          }
        },
        "LOGO_TYPE": {
          "label": "Logo type"
        },
        "LOGO_EMOJI": {
          "label": "Emoji",
          "display-condition": {
            "js": "LOGO_TYPE == 'emoji'"
          }
        },
        "LOGO_CHAR": {
          "label": "Logo text",
          "display-condition": {
            "js": "LOGO_TYPE == 'char'"
          }
        },
        "LOGO_SIZE": {
          "label": "Logo size",
          "display-condition": {
            "js": "LOGO_TYPE == 'char'"
          }
        },
        "LOGO_ROTATION": {
          "label": "Logo rotation",
          "display-condition": {
            "js": "LOGO_TYPE == 'char'"
          }
        },
        "Line_1_text": {
          "label": "Line 1"
        },
        "Line_2_text": {
          "label": "Line 2"
        },
        "Line_3_text": {
          "label": "Line 3"
        },
        "Line_4_text": {
          "label": "Line 4"
        },
        "Filter_Empty_Lines": {
          "label": "Skip empty lines"
        },
        "line_spacing_factor": {
          "label": "Line spacing"
        },
        "text_height": {
          "label": "Raised text height (mm)"
        },
        "margin_factor": {
          "label": "Margin"
        },
        "width": {
          "label": "Width (mm)"
        },
        "height": {
          "label": "Thickness (mm)"
        },
        "radius": {
          "label": "Corner radius (mm)"
        },
        "champfer": {
          "label": "Chamfer (mm)"
        },
        "Show_Divider": {
          "label": "Divider line"
        }
      },
      "hidden": [
        "Content_color",
        "Label_color"
      ]
    }
  ]
}
