{
  "$schema": "../../schema/family.schema.json",
  "id": "gridflock",
  "name": "GridFlock",
  "category": "gridfinity",
  "tags": [
    "baseplates",
    "drawer-fit",
    "puzzle",
    "magnets"
  ],
  "summary": "Drawer-fitting Gridfinity baseplates split to your printer bed, with puzzle joints and magnet options.",
  "authors": [
    {
      "name": "yawkat",
      "url": "https://github.com/yawkat"
    }
  ],
  "source": {
    "repository": "https://github.com/yawkat/GridFlock",
    "commit": "9788b3c77477d90694805dea8d4d27700f3ec542",
    "vendor_path": "vendor/gridflock"
  },
  "license": {
    "spdx": "MIT AND CC-BY-4.0",
    "public_use": "ok",
    "notes": "Bundled openGrid 3MF adapter assets are CC-BY-4.0 with attribution."
  },
  "links": {},
  "engine": {
    "min_version": "2025.01 (development snapshot)",
    "backend": "manifold",
    "notes": "Uses syntax that OpenSCAD 2021.01 cannot parse.",
    "library_paths": [
      "vendor/gridflock"
    ]
  },
  "status": "available",
  "models": [
    {
      "id": "baseplate",
      "name": "Baseplate",
      "entrypoint": "vendor/gridflock/gridflock.scad",
      "notes": "paths/puzzle.scad generated with upstream extract_paths.py.",
      "status": "available"
    }
  ]
}
