{
  "$schema": "../../schema/family.schema.json",
  "id": "hsw",
  "name": "Honeycomb Storage Wall",
  "category": "wall",
  "tags": [
    "wall",
    "honeycomb"
  ],
  "summary": "Customizable Honeycomb Storage Wall grids sized to your space.",
  "authors": [
    {
      "name": "Xander",
      "url": "https://www.printables.com/model/380870"
    },
    {
      "name": "Edwin Eefting",
      "url": "https://www.printables.com/model/530149"
    },
    {
      "name": "geru (continuation)",
      "url": "https://github.com/geru/3d-scad-hsw-customizable"
    }
  ],
  "source": {
    "repository": "https://github.com/geru/3d-scad-hsw-customizable",
    "commit": "b606f2e8427e7648748fdc9833f6621884e78d2e",
    "vendor_path": "vendor/hsw"
  },
  "license": {
    "spdx": "CC-BY-4.0",
    "public_use": "ok"
  },
  "links": {},
  "engine": {
    "min_version": "2021.01",
    "backend": "manifold",
    "library_paths": []
  },
  "status": "available",
  "models": [
    {
      "id": "grid",
      "name": "Grid",
      "entrypoint": "vendor/hsw/custom-honeycomb-wall-v2.scad",
      "notes": "Original v2 (as listed by the reference site).",
      "status": "available"
    },
    {
      "id": "grid-v2-3",
      "name": "Grid (v2.3 columns)",
      "entrypoint": "vendor/hsw/custom-honeycomb-wall-v2.3.scad",
      "notes": "Newer continuation with per-column control.",
      "status": "available"
    }
  ]
}
