{
  "$schema": "../../schema/family.schema.json",
  "id": "gridfinity-basket",
  "name": "Gridfinity Basket",
  "category": "carrying",
  "tags": [
    "baskets",
    "handles",
    "stacking"
  ],
  "summary": "Open-wall Gridfinity baskets with patterned walls, handles and stacking.",
  "authors": [
    {
      "name": "LeKoYa",
      "url": "https://github.com/LeKoYa"
    }
  ],
  "source": {
    "repository": "https://github.com/LeKoYa/gridfinity-basket-openscad",
    "commit": "549dc4015e4511daeb7b942de96d2531101701db",
    "vendor_path": "vendor/gridfinity-basket"
  },
  "license": {
    "spdx": "MIT",
    "public_use": "ok"
  },
  "links": {},
  "engine": {
    "min_version": "2025.01 (development snapshot)",
    "backend": "manifold",
    "notes": "Uses syntax that OpenSCAD 2021.01 cannot parse.",
    "library_paths": [
      "vendor/libraries"
    ]
  },
  "status": "available",
  "models": [
    {
      "id": "basket",
      "name": "Basket",
      "entrypoint": "vendor/gridfinity-basket/gridfinityBasket.scad",
      "status": "available"
    }
  ]
}
